### ISSUE TITLE
Client fails to connect with UDP packages routed via OpenVPN tunnel

### ISSUE THREAD

**Issue by alllexx88** [JoeJoeTV/AstroLauncher#3]
Thank you for this fork!

I have a somewhat complicated setup. My home network is behind a CGNAT, which means no public IPv4 is available. I'm also renting a small Ubuntu VPS with a dedicated IPv4 address. I setup an OpenVPN tunnel and NAT all UDP packets to the latter address over the tunnel to my Windows 11 game server. I had to configure firewall etc. for these packets not to be blocked, and now AstroLauncher prints `'Server network configuration good!'`. I also don't see any issue reports from in the launcher logs. When I launch Astroneer game on the same host, the server `<publicIP>:<port>` reports online with 0/8 players, however, after trying to connect, I get "Failed to connect to host". I see UDP packages flying through the tunnel wit Wireguard, sometimes it's only oneway (from VPS to Windows), sometimes it's back and forth. Since Astroneer doesn't write any logs, I'm at a loss on how to investigate it further.

Here's the log:

```
14:28:22 - INFO   'AstroLauncher - Unofficial Dedicated Server Launcher v1.8.5.1'
14:28:22 - INFO   'If you encounter any bugs please open a new issue at:'
14:28:22 - INFO   'https://github.com/JoeJoeTV/AstroLauncher/issues'
14:28:22 - INFO   'To safely stop the launcher and server press CTRL+C'
14:28:22 - INFO   'Starting a new session'
14:28:22 - INFO   'Attempting to validate Playfab Certs'
14:28:24 - INFO   'Checking the network configuration..'
14:28:27 - INFO   'Server network configuration good!'
14:28:37 - INFO   'Remote Console network configuration good!'
14:28:37 - INFO   'Backup retention started'
14:28:37 - INFO   'Running a web server at http://localhost:5000'
14:28:38 - INFO   'Starting Server process...'
14:28:39 - INFO   'Server started ( 1.33.14.0 )! Getting ready....'
14:29:22 - INFO   'Server ready! Took 43.31 seconds to register.'
14:29:22 - INFO   'Connected to RCON Console!'
14:29:26 - INFO   'Server FPS: 3'
14:32:19 - INFO   'Kill Server: Launcher shutting down via signal'
14:32:19 - INFO   'Server shutdown.'
14:32:21 - INFO   'Attemping to deregister all (1) servers matching self'
14:32:21 - INFO   'Deregistering 1/1...'
14:32:22 - INFO   'All servers deregistered'
```

Any ideas? Thanks in advance.

**Comment by JoeJoeTV** [comment]
Sorry for answering so late to this issue, I don't think Github sent me any mails regarding this and most issues get reported in the Discord, where I check more regularly.

If you still have the issue and are interested in solving it, here are some ideas:
1. Make sure the external port matches the one in the config, you can't re-route it, as that will cause issues
2. The IP of the VPS is probably different to the one that AstroLauncher filled in automatically, so make sure to set `OverwritePublicIP` to false in `launcher.ini` and set the `PublicIP` to the one you will actually use to connect to the server.

YOu can also use the online server checker to check for reachability: https://astroservercheck.joejoetv.de/

**Comment by alllexx88** [comment]
Thank you for your reply @JoeJoeTV 
I did make sure back then that both external IP is correct, `OverwritePublicIP` is set to `false`, and the external port matches the forwarded one. It didn't help sadly.

There's actually a continuation to this story. I now have a different VPS that supports nested KVM virtualization. I setup a qemu-kvm virtual machine with Windows 11 in it. I forwarded the UDP port from outside to the VM's interface. According to tcpdump, there's some communication between the client and the server, but after what looks like initial handshake, it only goes one way: from the client to the server:
```
$ sudo tcpdump -i tap0 udp port 8777 -n
tcpdump: verbose output suppressed, use -v[v]... for full protocol decode
listening on tap0, link-type EN10MB (Ethernet), snapshot length 262144 bytes
18:03:21.661160 IP <client_IP>.57666 > 10.0.0.2.8777: UDP, length 29
18:03:21.703366 IP 10.0.0.2.8777 > <client_IP>.57666: UDP, length 29
18:03:22.675172 IP <client_IP>.57666 > 10.0.0.2.8777: UDP, length 29
18:03:22.790129 IP 10.0.0.2.8777 > <client_IP>.57666: UDP, length 29
18:03:22.800958 IP <client_IP>.57666 > 10.0.0.2.8777: UDP, length 29
18:03:23.130101 IP 10.0.0.2.8777 > <client_IP>.57666: UDP, length 29
18:03:23.135665 IP <client_IP>.57666 > 10.0.0.2.8777: UDP, length 27
18:03:23.343459 IP <client_IP>.57666 > 10.0.0.2.8777: UDP, length 10
18:03:23.555703 IP <client_IP>.57666 > 10.0.0.2.8777: UDP, length 10
18:03:23.753737 IP <client_IP>.57666 > 10.0.0.2.8777: UDP, length 10
18:03:23.965325 IP <client_IP>.57666 > 10.0.0.2.8777: UDP, length 10
18:03:24.135247 IP <client_IP>.57666 > 10.0.0.2.8777: UDP, length 27
18:03:24.355716 IP <client_IP>.57666 > 10.0.0.2.8777: UDP, length 10
18:03:24.552857 IP <client_IP>.57666 > 10.0.0.2.8777: UDP, length 10
18:03:24.752236 IP <client_IP>.57666 > 10.0.0.2.8777: UDP, length 10
18:03:24.964622 IP <client_IP>.57666 > 10.0.0.2.8777: UDP, length 10
18:03:25.139092 IP <client_IP>.57666 > 10.0.0.2.8777: UDP, length 27
18:03:25.344709 IP <client_IP>.57666 > 10.0.0.2.8777: UDP, length 10
18:03:25.562898 IP <client_IP>.57666 > 10.0.0.2.8777: UDP, length 10
18:03:25.765119 IP <client_IP>.57666 > 10.0.0.2.8777: UDP, length 10
18:03:25.976187 IP <client_IP>.57666 > 10.0.0.2.8777: UDP, length 10
18:03:26.148321 IP <client_IP>.57666 > 10.0.0.2.8777: UDP, length 27
18:03:26.353869 IP <client_IP>.57666 > 10.0.0.2.8777: UDP, length 10
18:03:26.579735 IP <client_IP>.57666 > 10.0.0.2.8777: UDP, length 10
18:03:26.783824 IP <client_IP>.57666 > 10.0.0.2.8777: UDP, length 10
18:03:26.974350 IP <client_IP>.57666 > 10.0.0.2.8777: UDP, length 10
18:03:27.158308 IP <client_IP>.57666 > 10.0.0.2.8777: UDP, length 27
18:03:27.367696 IP <client_IP>.57666 > 10.0.0.2.8777: UDP, length 10
18:03:27.577588 IP <client_IP>.57666 > 10.0.0.2.8777: UDP, length 10
18:03:27.785410 IP <client_IP>.57666 > 10.0.0.2.8777: UDP, length 10
18:03:27.989294 IP <client_IP>.57666 > 10.0.0.2.8777: UDP, length 10
18:03:28.166247 IP <client_IP>.57666 > 10.0.0.2.8777: UDP, length 27
18:03:28.366434 IP <client_IP>.57666 > 10.0.0.2.8777: UDP, length 10
18:03:28.571806 IP <client_IP>.57666 > 10.0.0.2.8777: UDP, length 10
18:03:28.777803 IP <client_IP>.57666 > 10.0.0.2.8777: UDP, length 10
18:03:28.987189 IP <client_IP>.57666 > 10.0.0.2.8777: UDP, length 10
18:03:29.171773 IP <client_IP>.57666 > 10.0.0.2.8777: UDP, length 27
18:03:29.385101 IP <client_IP>.57666 > 10.0.0.2.8777: UDP, length 10
18:03:29.590640 IP <client_IP>.57666 > 10.0.0.2.8777: UDP, length 10
18:03:29.800347 IP <client_IP>.57666 > 10.0.0.2.8777: UDP, length 10
18:03:30.002949 IP <client_IP>.57666 > 10.0.0.2.8777: UDP, length 10
18:03:30.177357 IP <client_IP>.57666 > 10.0.0.2.8777: UDP, length 27
18:03:30.388268 IP <client_IP>.57666 > 10.0.0.2.8777: UDP, length 10
18:03:30.591098 IP <client_IP>.57666 > 10.0.0.2.8777: UDP, length 10
18:03:30.796338 IP <client_IP>.57666 > 10.0.0.2.8777: UDP, length 10
18:03:31.008289 IP <client_IP>.57666 > 10.0.0.2.8777: UDP, length 10
18:03:31.176698 IP <client_IP>.57666 > 10.0.0.2.8777: UDP, length 27
18:03:31.386408 IP <client_IP>.57666 > 10.0.0.2.8777: UDP, length 10
18:03:31.580995 IP <client_IP>.57666 > 10.0.0.2.8777: UDP, length 10
18:03:31.782321 IP <client_IP>.57666 > 10.0.0.2.8777: UDP, length 10
18:03:31.983281 IP <client_IP>.57666 > 10.0.0.2.8777: UDP, length 10
18:03:32.177162 IP <client_IP>.57666 > 10.0.0.2.8777: UDP, length 27
18:03:32.389326 IP <client_IP>.57666 > 10.0.0.2.8777: UDP, length 10
18:03:32.595151 IP <client_IP>.57666 > 10.0.0.2.8777: UDP, length 10
18:03:32.804612 IP <client_IP>.57666 > 10.0.0.2.8777: UDP, length 10
18:03:33.008621 IP <client_IP>.57666 > 10.0.0.2.8777: UDP, length 10
18:03:33.187587 IP <client_IP>.57666 > 10.0.0.2.8777: UDP, length 27
18:03:33.391786 IP <client_IP>.57666 > 10.0.0.2.8777: UDP, length 10
18:03:33.594218 IP <client_IP>.57666 > 10.0.0.2.8777: UDP, length 10
18:03:33.804289 IP <client_IP>.57666 > 10.0.0.2.8777: UDP, length 10
18:03:34.013325 IP <client_IP>.57666 > 10.0.0.2.8777: UDP, length 10
18:03:34.191772 IP <client_IP>.57666 > 10.0.0.2.8777: UDP, length 27
18:03:34.404957 IP <client_IP>.57666 > 10.0.0.2.8777: UDP, length 10
18:03:34.612250 IP <client_IP>.57666 > 10.0.0.2.8777: UDP, length 10
18:03:34.818628 IP <client_IP>.57666 > 10.0.0.2.8777: UDP, length 10
18:03:35.027755 IP <client_IP>.57666 > 10.0.0.2.8777: UDP, length 10
18:03:35.199065 IP <client_IP>.57666 > 10.0.0.2.8777: UDP, length 27
18:03:35.402339 IP <client_IP>.57666 > 10.0.0.2.8777: UDP, length 10
18:03:35.612681 IP <client_IP>.57666 > 10.0.0.2.8777: UDP, length 10
18:03:35.820184 IP <client_IP>.57666 > 10.0.0.2.8777: UDP, length 10
18:03:36.023421 IP <client_IP>.57666 > 10.0.0.2.8777: UDP, length 10
18:03:36.202956 IP <client_IP>.57666 > 10.0.0.2.8777: UDP, length 27
18:03:36.403113 IP <client_IP>.57666 > 10.0.0.2.8777: UDP, length 10
18:03:36.614202 IP <client_IP>.57666 > 10.0.0.2.8777: UDP, length 10
18:03:36.828289 IP <client_IP>.57666 > 10.0.0.2.8777: UDP, length 10
18:03:37.045247 IP <client_IP>.57666 > 10.0.0.2.8777: UDP, length 10
18:03:37.215804 IP <client_IP>.57666 > 10.0.0.2.8777: UDP, length 27
18:03:37.429598 IP <client_IP>.57666 > 10.0.0.2.8777: UDP, length 10
18:03:37.639913 IP <client_IP>.57666 > 10.0.0.2.8777: UDP, length 10
18:03:37.837727 IP <client_IP>.57666 > 10.0.0.2.8777: UDP, length 10
18:03:38.050671 IP <client_IP>.57666 > 10.0.0.2.8777: UDP, length 10
18:03:38.222751 IP <client_IP>.57666 > 10.0.0.2.8777: UDP, length 27
```

So it's unlikely that it's a network configuration issue. The network is masqueraded and forwarded like this (in `/etc/ufw/before.rules`):
```
# NAT for QEMU TAP
*nat
:PREROUTING ACCEPT [0:0]
:POSTROUTING ACCEPT [0:0]

# Masquerade outbound traffic from VM
-A POSTROUTING -s 10.0.0.0/24 -j MASQUERADE

# Port forwarding to VM
-A PREROUTING -p udp --dport 8777 -j DNAT --to-destination 10.0.0.2:8777
-A PREROUTING -p tcp --dport 3389 -j DNAT --to-destination 10.0.0.2:3389
-A PREROUTING -p udp --dport 3389 -j DNAT --to-destination 10.0.0.2:3389
```
and the firewall (`ufw`) is set to allow forwarding. 3389 port for RDP connection works fine, both TCP and UDP.

Also, it's not a client config issue, since using AstroTuxLauncher on the same VPS, I can connect to the server. I'm just having some performance issues with poligons rendering lagging with it, when quickly driving on a road built with drill+paver combo, making me fall underground on multiple occasions. I wanted to see if I'd get the same issue on a native Windows server (or, in case of my previous setup, also with a considerably faster CPU).

For now I'm just using AstroTuxLauncher, trying to drive safely on built roads 🥲

**Comment by JoeJoeTV** [comment]
Can you try to create a new savegame on the server and see if that changed anything?
What is the exact error that you get?

**Comment by alllexx88** [comment]
I don't get any errors in the server logs, there's complete silence there when I try to connect. The client just says "FAILED TO CONNECT" or something like this after trying to connect for a while (with a blur effect on). https://astroservercheck.joejoetv.de/ says that the server is working. I tried deleting the savegame, creating a new one, importing an old one, but it made no difference: server doesn't log any connection attempts.

**Comment by JoeJoeTV** [comment]
The dedicated server itself sadly _does not have any logging_.
And you are also connecting with the external IP and not i.e. a local IPv4, right?

**Comment by alllexx88** [comment]
Sure, otherwise I wouldn't be able to attempt a connection

**Comment by JoeJoeTV** [comment]
To add to there not being logging: The logging you see is only what AstroLauncher can deduce from the half-working "console" port interface.

**Comment by JoeJoeTV** [comment]
> Sure, otherwise I wouldn't be able to attempt a connection

hmm, you say AstroTuxLauncher works fine? is this with encryption disabled (the default) or enabled?

**Comment by alllexx88** [comment]
I disabled encryption on the clients and left it off on the server.

Now that you mention it, could it be that I (probably) haven't disabled it for AstroLauncher? I need to check it.

**Comment by alllexx88** [comment]
@JoeJoeTV Awesome, your guess was right! Thank you 😄 Now I need to test how it performs a bit later
